Reading List ID,Google Books ID,Apple Books ID,ISBN-13,Title,Subtitle,Authors,Page Count,Publication Date,Publisher,Description,Subjects,Language Code,Started Reading,Paused,Finished Reading,Did Not Finish,Current Page,Current Percentage,Rating,Notes,Lists
3FF5DB48-6290-46D1-A5BA-E5B09D49320A,jHWUzQEACAAJ,,9780008425043,Letters from a Stoic (Collins Classics),,"Seneca, Lucius",256,,HarperCollins Publishers Limited,"HarperCollins is proud to present its incredible range of best-loved, essential classics.

No man can live a happy life, or even a supportable life, without the study of wisdom

Lucius Annaeus Seneca (4 BC-AD 65) is one of the most famous Roman philosophers. Instrumental in guiding the Roman Empire under emperor Nero, Seneca influenced him from a young age with his Stoic principles. Later in life, he wrote Epistulae Morales ad Lucilium, or Letters from a Stoic, detailing these principles in full.

Seneca's letters read like a diary, or a handbook of philosophical meditations. Often beginning with observations on daily life, the letters focus on many traditional themes of Stoic philosophy, such as the contempt of death, the value of friendship and virtue as the supreme good.

Using Gummere's translation from the early twentieth century, this selection of Seneca's letters shows his belief in the austere, ethical ideals of Stoicism - teachings we can still learn from today.","Ancient & Classical; Body, Mind & Spirit; Education; Essays; Ethics & Moral Philosophy; Literary Collections; Mind & Body; Mindfulness & Meditation; Philosophy; Philosophy, Theory & Social Aspects",en,,,,,,,,,
C750F24A-CA38-44AC-ADFE-F07E5CABD524,IMtGnwEACAAJ,,9780743264730,Einstein,His Life and Universe,"Isaacson, Walter",675,,Simon & Schuster,"By the author of the acclaimed bestsellers Benjamin Franklin and Steve Jobs, this is the definitive biography of Albert Einstein. 

How did his mind work? What made him a genius? Isaacson’s biography shows how his scientific imagination sprang from the rebellious nature of his personality. His fascinating story is a testament to the connection between creativity and freedom.

Based on newly released personal letters of Einstein, this book explores how an imaginative, impertinent patent clerk—a struggling father in a difficult marriage who couldn’t get a teaching job or a doctorate—became the mind reader of the creator of the cosmos, the locksmith of the mysteries of the atom, and the universe. His success came from questioning conventional wisdom and marveling at mysteries that struck others as mundane. This led him to embrace a morality and politics based on respect for free minds, free spirits, and free individuals.

These traits are just as vital for this new century of globalization, in which our success will depend on our creativity, as they were for the beginning of the last century, when Einstein helped usher in the modern age.",20th Century; Biography & Autobiography; History; Modern; Physics; Relativity; Science; Science & Technology,en,,,,,,,,,Bookshelf (25)
52F74261-28B5-458B-94F5-E3F4A41F09E2,0Fn0QAAACAAJ,,9780753819968,The Ancestor's Tale,A Pilgrimage to the Dawn of Life,"Dawkins, Richard; Wong, Yan",685,,Phoenix,"One of the most brilliant scientists of our age gives us his definitive work: a synthesis of his comprehensive vision of life.

THE ANCESTOR'S TALE is a pilgrimage back through time; a journey on which we meet up with fellow pilgrims as we and they converge on our common ancestors. Chimpanzees join us at about 6 million years in the past, orang utans at 14 million years, as we stride on together, a growing band. The journey provides the setting for a collection of some 40 tales.

Each explores an aspect of evolutionary biology through the stories of characters met along the way. The tales are interspersed with prologues detailing the journey, route maps showing joining lineages, and life-like reconstructions of our common ancestors. THE ANCESTOR'S TALE represents a pilgrimage on an unimaginable scale: our goal is four billion years away, and the number of pilgrims joining us grows vast - ultimately encompassing all living creatures. At the end of the journey lies something remarkable in its simplicity and transformative power: the first, humble, replicating molecules.",,en,,,,,,,,,Bookshelf (3)
171BBE90-81B4-4AF9-85B8-303665FFC066,GkqdlwEACAAJ,,9780316029186,The Last Wish,Introducing the Witcher,"Sapkowski, Andrzej",384,,Orbit,"Soon to be a major Netflix original series!
Geralt the Witcher -- revered and hated -- holds the line against the monsters plaguing humanity in this collection of adventures in the NYT bestselling series that inspired the blockbuster video games. 
Geralt is a Witcher, a man whose magic powers, enhanced by long training and a mysterious elixir, have made him a brilliant fighter and a merciless assassin. Yet he is no ordinary murderer: his targets are the multifarious monsters and vile fiends that ravage the land and attack the innocent.
But not everything monstrous-looking is evil and not everything fair is good...and in every fairy tale there is a grain of truth.
Andrzej Sapkowski, winner of the World Fantasy Lifetime Achievement award, started an international phenomenon with his Witcher series. The Last Wish short story collection is the perfect introduction to this one of a kind fantasy world.

Witcher collectionsThe Last WishSword of Destiny
Witcher novelsBlood of Elves
The Time of Contempt
Baptism of Fire The Tower of SwallowsLady of the LakeSeason of Storms
The Malady and Other Stories: An Andrzej Sapkowski Sampler (e-only)

Translated from original Polish by Danusia Stok",Action & Adventure; Collections & Anthologies; Dragons & Mythical Creatures; Epic; Fantasy; Fiction,en,,,,,,,,,Bookshelf (5)
94D8DAC1-9E68-40AA-AC98-4DADFB464C21,TlzhDwAAQBAJ,,9781982159375,On Writing,A Memoir of the Craft,"King, Stephen",320,,Simon and Schuster,"Twentieth Anniversary Edition with Contributions from Joe Hill and Owen King

Immensely helpful and illuminating to any aspiring writer, this special edition of Stephen King’s critically lauded, million-copy bestseller shares the experiences, habits, and convictions that have shaped him and his work.

“Long live the King” hailed Entertainment Weekly upon publication of Stephen King’s On Writing. Part memoir, part master class by one of the bestselling authors of all time, this superb volume is a revealing and practical view of the writer’s craft, comprising the basic tools of the trade every writer must have. King’s advice is grounded in his vivid memories from childhood through his emergence as a writer, from his struggling early career to his widely reported, near-fatal accident in 1999—and how the inextricable link between writing and living spurred his recovery. Brilliantly structured, friendly and inspiring, On Writing will empower and entertain everyone who reads it—fans, writers, and anyone who loves a great story well told.",Biography & Autobiography; Composition & Creative Writing; Language Arts & Disciplines; Personal Memoirs; Style Manuals,en,,,,,,,,,Bookshelf (7)
09F16625-EF25-4D03-ABC0-2B50B09DB649,IcM3DwAAQBAJ,,9781101980019,Martin Luther,The Man Who Rediscovered God and Changed the World,"Metaxas, Eric",496,,Penguin Publishing Group,"NEW YORK TIMES BESTSELLER

“Metaxas is a scrupulous chronicler and has an eye for a good story. . . . full, instructive, and pacey.” —The Washington Post

From #1 New York Times bestselling author Eric Metaxas comes a brilliant and inspiring biography of the most influential man in modern history, Martin Luther, in time for the 500th anniversary of the Reformation

On All Hallow’s Eve in 1517, a young monk named Martin Luther posted a document he hoped would spark an academic debate, but that instead ignited a conflagration that would forever destroy the world he knew. Five hundred years after Luther’s now famous Ninety-five Theses appeared, Eric Metaxas, acclaimed biographer of the bestselling Bonhoeffer: Pastor, Martyr, Prophet, Spy and Amazing Grace: William Wilberforce and the Heroic Campaign to End Slavery, paints a startling portrait of the wild figure whose adamantine faith cracked the edifice of Western Christendom and dragged medieval Europe into the future. Written in riveting prose and impeccably researched, Martin Luther tells the searing tale of a humble man who, by bringing ugly truths to the highest seats of power, caused the explosion whose sound is still ringing in our ears. Luther’s monumental faith and courage gave birth to the ideals of liberty, equality, and individualism that today lie at the heart of all modern life.",16th Century; Biography & Autobiography; Christianity; History; Modern; Protestant; Religion; Religious,en,,,,,,,,,
4BCF9D56-175B-4F32-8463-AF1A92A74A20,oGpmAAAAMAAJ,,9780679438083,Titan,"The Life of John D. Rockefeller, Sr","Chernow, Ron",774,,Random House,"John D. Rockefeller, Sr.--history's first billionaire and the patriarch of America's most famous dynasty--is an icon whose true nature has eluded three generations of historians. Now Ron Chernow, the National Book Award-winning biographer of the Morgan and Warburg banking families, gives us a history of the mogul ""etched with uncommon objectivity and literary grace . . . as detailed, balanced, and psychologically insightful a portrait of the tycoon as we may ever have"" (Kirkus Reviews). Titan is the first full-length biography based on unrestricted access to Rockefeller's exceptionally rich trove of papers. A landmark publication full of startling revelations, the book will indelibly alter our image of this most enigmatic capitalist. Born the son of a flamboyant, bigamous snake-oil salesman and a pious, straitlaced mother, Rockefeller rose from rustic origins to become the world's richest man by creating America's most powerful and feared monopoly, Standard Oil. Branded ""the Octopus"" by legions of muckrakers, the trust refined and marketed nearly 90 percent of the oil produced in America. Rockefeller was likely the most controversial businessman in our nation's history. Critics charged that his empire was built on unscrupulous tactics: grand-scale collusion with the railroads, predatory pricing, industrial espionage, and wholesale bribery of political officials. The titan spent more than thirty years dodging investigations until Teddy Roosevelt and his trustbusters embarked on a marathon crusade to bring Standard Oil to bay. While providing abundant new evidence of Rockefeller's misdeeds, Chernow discards the stereotype of the cold-blooded monster to sketch an unforgettably human portrait of a quirky, eccentric original. A devout Baptist and temperance advocate, Rockefeller gave money more generously--his chosen philanthropies included the Rockefeller Foundation, the University of Chicago, and what is today Rockefeller University--than anyone before him. Titan presents a finely nuanced portrait of a fascinating, complex man, synthesizing his public and private lives and disclosing numerous family scandals, tragedies, and misfortunes that have never before come to light. John D. Rockefeller's story captures a pivotal moment in American history, documenting the dramatic post-Civil War shift from small business to the rise of giant corporations that irrevocably transformed the nation. With cameos by Joseph Pulitzer, William Randolph Hearst, Jay Gould, William Vanderbilt, Ida Tarbell, Andrew Carnegie, Carl Jung, J. Pierpont Morgan, William James, Henry Clay Frick, Mark Twain, and Will Rogers, Titan turns Rockefeller's life into a vivid tapestry of American society in the late nineteenth and early twentieth centuries. It is Ron Chernow's signal triumph that he narrates this monumental saga with all the sweep, drama, and insight that this giant subject deserves. From the Hardcover edition.",Biography & Autobiography; Business; Historical; Rich & Famous,en,,,,,,,,,
6F6E80DF-2D43-495C-8566-46226FF1526B,YdOYmYA2TJYC,,9780812979183,The Black Swan,,"Taleb, Nassim Nicholas",366,,Random House,"In the author's point of view, a black swan is an improbable event with three principal characteristics - It is unpredictable; it carries a massive impact; and, after the fact, we concoct an explanation that makes it appear less random, and more predictable, than it was. Why do we not acknowledge the phenomenon of black swans until after they occur? Part of the answer, according to Taleb, is that humans are hardwired to learn specifics when they should be focused on generalities. We concentrate on things we already know and time and time again fail to take into consideration what we don't know. We are, therefore, unable to truly estimate opportunities, too vulnerable to the impulse to simplify, narrate, and categorize, and not open enough to rewarding those who can imagine the 'impossible'.",,en,,,,,,,,,
DA012E6D-1E23-4246-9E6F-F2CB6D16D04A,KJvuJnzbtJAC,,9780141439563,Great Expectations,,"Dickens, Charles",514,,Penguin Publishing Group,"'Great Expectations is up there for me with the world's greatest novels' Howard Jacobson. Nominated as one of America’s best-loved novels by PBS’s The Great American Read

Charles Dickens's Great Expectations charts the course of orphan Pip Pirrip's life as it is transformed by a vast, mysterious inheritance. A terrifying encounter with the escaped convict Abel Magwitch in a graveyard on the wild Kent marshes; a summons to meet the bitter, decrepit Miss Havisham and her beautiful, cold-hearted ward Estella at Satis House; the sudden generosity of a mysterious benefactor - these form a series of events that change the orphaned Pip's life forever, and he eagerly abandons his humble station as an apprentice to blacksmith Joe Gargery, beginning a new life as a gentleman. Charles Dickens's haunting late novel depicts Pip's education and development through adversity as he discovers the true nature of his identity, and his 'great expectations'. This definitive version uses the text from the first published edition of 1861. It includes a map of Kent in the early nineteenth century, and appendices on Dickens's original ending and his working notes, giving readers an illuminating glimpse into the mind of a great novelist at work.

For more than seventy years, Penguin has been the leading publisher of classic literature in the English-speaking world. With more than 1,700 titles, Penguin Classics represents a global bookshelf of the best works throughout history and across genres and disciplines. Readers trust the series to provide authoritative texts enhanced by introductions and notes by distinguished scholars and contemporary authors, as well as up-to-date translations by award-winning translators.",Classics; Fiction; Gothic; Literary,en,,,,,,,,,
215FF73F-C954-47E6-947B-A3C12E9D4A66,4siMEAAAQBAJ,,9780241951446,Penguin Essentials a Clockwork Orange,,"Burgess, Anthony",160,,Penguin UK,"The daring dystopian satire that inspired one of the most notorious films ever made, beautifully reimagined as part of the Penguin Essentials series

'Every generation should discover this book' Time Out
________________

In this nightmare vision of youth in revolt, fifteen-year-old Alex and his friends set out on a diabolical orgy of robbery, rape, torture and murder. Alex is jailed for his teenage delinquency and the State tries to reform him - but at what cost?

Experiment of language? Social prophecy? Black comedy? A Clockwork Orange is all of these.

Dazzling and transgressive, this frightening fable about good and evil asks the meaning of human freedom.
________________

'A gruesomely witty cautionary tale' Time

'Not only about man's violent nature and his capacity to choose between good and evil. It is about the excitements and intoxicating effects of language' Daily Telegraph

'I do not know of any other writer who has done as much with language . . . a very funny book' William S. Burroughs

'One of the cleverest and most original writers of his generation' The Times",Dystopian; Fiction,en,,,,,,,,,
6030DFCA-B58A-4176-A5D5-2B31FBA6FCA8,3gPEQgAACAAJ,,9780333666135,Kosovo,A Short History,"Malcolm, Noel",492,,Macmillan,"with a new introduction by the author""What could have been mere academic hairsplitting in the hands of another author is transformed by Malcolm into a thrilling detective story."" --New York Times Book Review""Excellent."" --The New York Review of Books""In this awe-inspiring work, Malcolm has created an essential aid to anyone who wishes to understand this tragic region today. . . . His book is exceptional not only for his unimpeachable research, but also for his equitable examination of the conflicting ethnic views of what really happened in this contentious region, and his determination to debunk dangerous myths."" --Publishers Weekly (starred review)""A book every policy expert, journalist and lay person must read."" --Wall Street Journal""Malcolm's narrative is gripping, even brilliant at times. . . . He takes to his task with the vigor of a detective driven by true passion. At times his claims are, in terms of Balkan history, quite revolutionary."" --The Economist",,en,,,,,,,,,
89C34EAA-98AF-4D0B-A988-729C5A40A397,tkr_03qNJmoC,,9780679643685,The Bed of Procrustes,Philosophical and Practical Aphorisms,"Taleb, Nassim Nicholas",176,,Random House Publishing Group,"The author of the modern classics The Black Swan, Fooled by Randomness, and Antifragile, Nassim Nicholas Taleb expresses major ideas in ways you least expect in this collection of aphorisms and meditations—now expanded with fifty percent more material than the hardcover.
 
The Bed of Procrustes takes its title from the Greek myth of a man who made his visitors fit his bed to perfection, either by stretching them or by cutting their limbs. It represents Taleb’s view of modern civilization’s hubristic side effects—modifying humans to satisfy technology, blaming reality for not fitting economic models, inventing diseases to sell drugs, defining intelligence as what can be tested in a classroom, and convincing people that employment is not slavery. Playful and irreverent, these aphorisms will surprise you by exposing self-delusions you have been living with but never recognized.

With a rare combination of pointed wit and potent wisdom, Taleb plows through human illusions, contrasting the classical values of courage, elegance, and erudition with the modern diseases of nerdiness, philistinism, and phonies.",Business & Economics; Corporate Finance; Philosophy; Psychology; Social; Social Psychology,en,,,,,,,,,
A5C18A73-0F02-4058-BBFC-A901431DB084,QGaMDQAAQBAJ,,9780812979688,Antifragile,Things That Gain from Disorder,"Taleb, Nassim Nicholas",544,,Random House Publishing Group,"Antifragile is a standalone book in Nassim Nicholas Taleb’s landmark Incerto series, an investigation of opacity, luck, uncertainty, probability, human error, risk, and decision-making in a world we don’t understand. The other books in the series are Fooled by Randomness, The Black Swan, Skin in the Game, and The Bed of Procrustes.

Nassim Nicholas Taleb, the bestselling author of The Black Swan and one of the foremost thinkers of our time, reveals how to thrive in an uncertain world.

Just as human bones get stronger when subjected to stress and tension, and rumors or riots intensify when someone tries to repress them, many things in life benefit from stress, disorder, volatility, and turmoil. What Taleb has identified and calls “antifragile” is that category of things that not only gain from chaos but need it in order to survive and flourish.

In The Black Swan, Taleb showed us that highly improbable and unpredictable events underlie almost everything about our world. In Antifragile, Taleb stands uncertainty on its head, making it desirable, even necessary, and proposes that things be built in an antifragile manner. The antifragile is beyond the resilient or robust. The resilient resists shocks and stays the same; the antifragile gets better and better.

Furthermore, the antifragile is immune to prediction errors and protected from adverse events. Why is the city-state better than the nation-state, why is debt bad for you, and why is what we call “efficient” not efficient at all? Why do government responses and social policies protect the strong and hurt the weak? Why should you write your resignation letter before even starting on the job? How did the sinking of the Titanic save lives? The book spans innovation by trial and error, life decisions, politics, urban planning, war, personal finance, economic systems, and medicine. And throughout, in addition to the street wisdom of Fat Tony of Brooklyn, the voices and recipes of ancient wisdom, from Roman, Greek, Semitic, and medieval sources, are loud and clear.

Antifragile is a blueprint for living in a Black Swan world.

Erudite, witty, and iconoclastic, Taleb’s message is revolutionary: The antifragile, and only the antifragile, will make it.

Praise for Antifragile

“Ambitious and thought-provoking . . . highly entertaining.”—The Economist

“A bold book explaining how and why we should embrace uncertainty, randomness, and error . . . It may just change our lives.”—Newsweek",Business & Economics; Decision-Making & Problem Solving; Investments & Securities; Movements; Phenomenology; Philosophy; Stocks,en,,,,,,,,,
200AA109-7F41-46AC-8804-6916E130FFF7,a_7TAAAACAAJ,,9780141023922,Miracles and Idolatry,,Voltaire,127,,Penguin,"Throughout history, some books have changed the world. They have transformed the way we see ourselves - and each other. They have inspired debate, dissent, war and revolution. They have enlightened, outraged, provoked and comforted. They have enriched lives - and destroyed them. Now Penguin brings you the works of the great thinkers, pioneers, radicals and visionaries whose ideas shook civilization and helped make us who we are.

Voltaire's short, radical and iconoclastic essays on philosophical ideas from angels to idolatry, miracles to wickedness, make wry observations about human beliefs, and mock hypocrisy and extravagant piety - his call to his fellow men to act with reason and see through the lies they are fed by their leaders has provided inspiration to freethinkers everywhere.",Essays; History & Surveys; Literary Collections; Literary Criticism; Modern; Philosophy; Religious,en,,,,,,,,,
FC45CA0C-29C2-47DD-A7EA-B09ED7D8F4CF,AifhDwAAQBAJ,,9781982164799,Principles for Dealing with the Changing World Order,Why Nations Succeed and Fail,"Dalio, Ray",576,,Simon and Schuster,"NEW YORK TIMES BESTSELLER * MORE THAN ONE MILLION COPIES SOLD

“A provocative read...There are few tomes that coherently map such broad economic histories as well as Mr. Dalio’s. Perhaps more unusually, Mr. Dalio has managed to identify metrics from that history that can be applied to understand today.” —Andrew Ross Sorkin, The New York Times

From legendary investor Ray Dalio, author of the #1 New York Times bestseller Principles, who has spent half a century studying global economies and markets, Principles for Dealing with the Changing World Order examines history’s most turbulent economic and political periods to reveal why the times ahead will likely be radically different from those we’ve experienced in our lifetimes—and to offer practical advice on how to navigate them well. 

A few years ago, Ray Dalio noticed a confluence of political and economic conditions he hadn’t encountered before. They included huge debts and zero or near-zero interest rates that led to massive printing of money in the world’s three major reserve currencies; big political and social conflicts within countries, especially the US, due to the largest wealth, political, and values disparities in more than 100 years; and the rising of a world power (China) to challenge the existing world power (US) and the existing world order. The last time that this confluence occurred was between 1930 and 1945. This realization sent Dalio on a search for the repeating patterns and cause/effect relationships underlying all major changes in wealth and power over the last 500 years.

In this remarkable and timely addition to his Principles series, Dalio brings readers along for his study of the major empires—including the Dutch, the British, and the American—putting into perspective the “Big Cycle” that has driven the successes and failures of all the world’s major countries throughout history. He reveals the timeless and universal forces behind these shifts and uses them to look into the future, offering practical principles for positioning oneself for what’s ahead.",21st Century; Business & Economics; Economics; Economics & Trade; History; International; Macroeconomics; Modern,en,,,,,,,,,Bookshelf (30)
9CFDF362-A3A9-4D24-8565-618A50D0C0BD,AXVUqdzi3rsC,,9781101157879,Dune Messiah,,"Herbert, Frank",336,,Penguin,"Book Two in the Magnificent Dune Chronicles—the Bestselling Science Fiction Adventure of All Time

Dune Messiah continues the story of Paul Atreides, better known—and feared—as the man christened Muad’Dib. As Emperor of the known universe, he possesses more power than a single man was ever meant to wield. Worshipped as a religious icon by the fanatical Fremen, Paul faces the enmity of the political houses he displaced when he assumed the throne—and a conspiracy conducted within his own sphere of influence.

And even as House Atreides begins to crumble around him from the machinations of his enemies, the true threat to Paul comes to his lover, Chani, and the unborn heir to his family’s dynasty...",Classics; Epic; Fantasy; Fiction; Science Fiction; Space Opera,en,,,,,,,,,Bookshelf (21)
