Reading List ID,Google Books ID,Apple Books ID,ISBN-13,Title,Subtitle,Authors,Page Count,Publication Date,Publisher,Description,Subjects,Language Code,Started Reading,Paused,Finished Reading,Did Not Finish,Current Page,Current Percentage,Rating,Notes,Lists
262E80D0-FF51-45FF-8D25-987C7A3781C5,uOMt_XCo81QC,,9781101561089,The Idea Factory,Bell Labs and the Great Age of American Innovation,"Gertner, Jon",360,,Penguin,"The definitive history of America’s greatest incubator of innovation and the birthplace of some of the 20th century’s most influential technologies

“Filled with colorful characters and inspiring lessons . . . The Idea Factory explores one of the most critical issues of our time: What causes innovation?” —Walter Isaacson, The New York Times Book Review

“Compelling . . . Gertner's book offers fascinating evidence for those seeking to understand how a society should best invest its research resources.” —The Wall Street Journal

From its beginnings in the 1920s until its demise in the 1980s, Bell Labs-officially, the research and development wing of AT&T-was the biggest, and arguably the best, laboratory for new ideas in the world. From the transistor to the laser, from digital communications to cellular telephony, it's hard to find an aspect of modern life that hasn't been touched by Bell Labs. In The Idea Factory, Jon Gertner traces the origins of some of the twentieth century's most important inventions and delivers a riveting and heretofore untold chapter of American history. At its heart this is a story about the life and work of a small group of brilliant and eccentric men-Mervin Kelly, Bill Shockley, Claude Shannon, John Pierce, and Bill Baker-who spent their careers at Bell Labs. Today, when the drive to invent has become a mantra, Bell Labs offers us a way to enrich our understanding of the challenges and solutions to technological innovation. Here, after all, was where the foundational ideas on the management of innovation were born.",20th Century; Business & Economics; Corporate & Business History; History; Inventions; Technology & Engineering; United States,en,2024-01-29,,2024-03-08,,,,5.0,"Very insightful and interesting book. This one takes you through the history of Bell Labs from the very beginning to what remains of it today (although one could argue it died when AT&T broke up). 

Learning about various great minds such as Bill Shockley, and Claude Shannon and getting a glimpse behind the scenes of great innovations such as the transistor was fascinating.

My particular takeaways from the novel were two in particular. The first being that I want to work alongside other great minds! This book demonstrates the advantage of putting a ton of the greatest minds all in one place, which is that they tend to generate beautiful and innovative ideas! Even ones like Claude Shannon’s Information Theory which is attributed solely to him was surely helped by having so many other great minds around him. Also observing the multidisciplinary nature of the lab and how this played a key part in the innovation of the transistor in particular inspired me to explore topics and subject I’m not experienced in such as electronics and web design.  

My second major takeaway was great minds are unique minds. What I mean by this is that after reading Feynman’s bio and after reading about the lives of Shannon, Shockley, Piece, etc. I’ve learned that the greatest minds have their own ways of generating ideas and working. There’s no single formula to conducting research or working on a problem. While this is a bit obvious it was particularly important to me as it inspired me to begin exploring different ways of putting myself in positions to think more. I’ve begun going on more walks, writing down things, removing headphones/distractions from my daily life, and overall I’ve spent more time thinking everyday. I also felt some of my prior intuitions were reinforced after reading this. Things like how I tend to jump all over the place with my interests and passion projects (i.e. robots, electronics, software, finance, math, etc.) was reflected in how John Pierce jumped from different passions and interests (gliders, satellites, mobile phones, lasers, etc.). As well as my recent (2 years) resurgence in interest in reading albeit for different reasons (I read a lot of fiction as a child but now am more interested in thought-provoking material) being reflected in how Claude Shannon kept a home library which he explored and used to his heart’s content in his later years.

There’s a lot more this book showed such as how important ideas can have such humble beginnings (humble either through the humble backgrounds of all the scientists or by where the idea came from) as well as how these ideas can be manifested through chance encounters. Bell Labs was unique, and perhaps we will never have anything remotely close it again. The lessons learned from Bell Labs can be taken by many as they seek to work on important ideas in the future. ",
F91F5B69-E2C6-4648-877F-E78B2DF29FD4,7NMylz2zPOMC,,9781423145400,"Lost Hero, The (Heroes of Olympus, The, Book One)",,"Riordan, Rick",576,,Disney Electronic Content,"Jason has a problem. He doesn't remember anything before waking up on a school bus holding hands with a girl. Apparently she's his girlfriend Piper, his best friend is a kid named Leo, and they're all students in the Wilderness School, a boarding school for ""bad kids."" What he did to end up here, Jason has no idea—except that everything seems very wrong.","Action & Adventure; Fantasy & Magic; Greek & Roman; Juvenile Fiction; Legends, Myths, Fables",en,2024-03-18,,2024-03-19,,,,,,
04CAAC35-1700-4FD7-B72B-930777189AC8,02oZzQEACAAJ,,9781423140597,"Heroes of Olympus, The, Book Two: The Son of Neptune",,"Riordan, Rick",544,,Hyperion Book CH,"Percy is confused. When he awoke after his long sleep, he didn’t know much more than his name. His brain-fuzz is lingering, even after the wolf Lupa told him he is a demigod and trained him to fight. Somehow Percy managed to make it to the camp for half-bloods, despite the fact that he had to continually kill monsters that, annoyingly, would not stay dead. But the camp doesn't ring any bells with him.
Hazel is supposed to be dead. When she lived before, she didn’t do a very good job of it. When the Voice took over her mother and commanded Hazel to use her “gift” for an evil purpose, Hazel couldn’t say no. Now, because of her mistake, the future of the world is at risk. 
Frank is a klutz. His grandmother claims he is descended from ancient heroes and can be anything he wants to be, but he doesn’t see it. He doesn’t even know who his father is. He keeps hoping Apollo will claim him, because the only thing he is good at is archery—although not good enough to help the Fifth Cohort win at war games. His big and bulky physique makes him feel like a clumsy ox, especially in front of Hazel, his closest friend at camp. He trusts her completely—enough, even, to share the secret he holds close to his heart. 
Beginning at the “other” camp for half-bloods and extending as far north as the land beyond the gods, this breathtaking second installment in the Heroes of Olympus series introduces new demigods, revives fearsome monsters, and features other remarkable creatures, all of whom are destined to play a part in the most important quest of all: the Prophecy of Seven.","Action & Adventure; Fantasy & Magic; Juvenile Fiction; Legends, Myths, Fables; Other",en,2024-03-19,,2024-03-22,,,,,,
0DF0E624-A260-4210-B695-4128455567B4,QtbOnQEACAAJ,,9781423140603,"Heroes of Olympus, The , Book Three: The Mark of Athena",,"Riordan, Rick",608,,Hyperion Book CH,"In The Son of Neptune, Percy, Hazel, and Frank met in Camp Jupiter, the Roman equivalent of Camp Halfblood, and traveled to the land beyond the gods to complete a dangerous quest. The third book in the Heroes of Olympus series will unite them with Jason, Piper, and Leo. But they number only six--who will complete the Prophecy of Seven? /DIV
The Greek and Roman demigods will have to cooperate in order to defeat the giants released by the Earth Mother, Gaea. Then they will have to sail together to the ancient land to find the Doors of Death. What exactly are the Doors of Death? Much of the prophesy remains a mystery. . . . DIVWith old friends and new friends joining forces, a marvelous ship, fearsome foes, and an exotic setting, The Mark of Athena promises to be another unforgettable adventure by master storyteller Rick Riordan.","Action & Adventure; Fantasy & Magic; Greek & Roman; Juvenile Fiction; Legends, Myths, Fables; Other",en,2024-03-22,,2024-03-24,,,,,,
4406B7BE-C531-48CC-961D-7E4D16B13A5F,SoxV9OyP0TcC,,9781423155157,"The Heroes of Olympus, Book Four: The House of Hades",,"Riordan, Rick",608,,Disney Electronic Content,"At the conclusion of The Mark of Athena, Annabeth and Percy tumble into a pit leading straight to the Underworld. The other five demigods have to put aside their grief and follow Percy's instructions to find the mortal side of the Doors of Death. If they can fight their way through the Gaea's forces, and Percy and Annabeth can survive the House of Hades, then the Seven will be able to seal the Doors from both sides and prevent the giants from raising Gaea. But, Leo wonders, if the Doors are sealed, how will Percy and Annabeth be able to escape?

They have no choice. If the demigods don't succeed, Gaea's armies will never die. They have no time. In about a month, the Romans will march on Camp Half-Blood. The stakes are higher than ever in this adventure that dives into the depths of Tartarus.","Action & Adventure; Fantasy & Magic; Greek & Roman; Juvenile Fiction; Legends, Myths, Fables",en,2024-03-24,,2024-03-27,,,,,,
B8F38325-0913-4727-8796-ACDD548E8FB2,BWs1nwEACAAJ,,9781423146735,The Heroes of Olympus Book Five: The Blood of Olympus,,"Riordan, Rick",528,,Disney-Hyperion,"Though the Greek and Roman crewmembers of the Argo II have made progress in their many quests, they still seem no closer to defeating the earth mother, Gaea. Her giants have risen-all of them-and they're stronger than ever. They must be stopped before the Feast of Spes, when Gaea plans to have two demigods sacrificed in Athens. She needs their blood-the blood of Olympus-in order to wake.

The demigods are having more frequent visions of a terrible battle at Camp Half-Blood. The Roman legion from Camp Jupiter, led by Octavian, is almost within striking distance. Though it is tempting to take the Athena Parthenos to Athens to use as a secret weapon, the friends know that the huge statue belongs back on Long Island, where it might be able to stop a war between the two camps.

The Athena Parthenos will go west; the Argo II will go east. The gods, still suffering from multiple personality disorder, are useless. How can a handful of young demigods hope to persevere against Gaea's army of powerful giants? As dangerous as it is to head to Athens, they have no other option. They have sacrificed too much already. And if Gaea wakes, it is game over.","Action & Adventure; Fantasy & Magic; Greek & Roman; Juvenile Fiction; Legends, Myths, Fables",en,2024-03-27,,2024-04-02,,,,,,
437894E9-A834-443C-B03D-F99967BBE96D,M0U5tAEACAAJ,,9780465043576,The Misbehavior of Markets,A Fractal View of Financial Turbulence,"Mandelbrot, Benoit; Hudson, Richard L.",276,,Basic Books,"Mathematical superstar and inventor of fractal geometry, Benoit Mandelbrot, has spent the past forty years studying the underlying mathematics of space and natural patterns. What many of his followers don't realize is that he has also been watching patterns of market change. In The (Mis)Behavior of Markets, Mandelbrot joins with science journalist and former Wall Street Journal editor Richard L. Hudson to reveal what a fractal view of the world of finance looks like. The result is a revolutionary reevaluation of the standard tools and models of modern financial theory. Markets, we learn, are far riskier than we have wanted to believe. From the gyrations of IBM's stock price and the Dow, to cotton trading, and the dollar-Euro exchange rate--Mandelbrot shows that the world of finance can be understood in more accurate, and volatile, terms than the tired theories of yesteryear.The ability to simplify the complex has made Mandelbrot one of the century's most influential mathematicians. With The (Mis)Behavior of Markets, he puts the tools of higher mathematics into the hands of every person involved with markets, from financial analysts to economists to 401(k) holders. Markets will never be seen as ""safe bets"" again.",Business & Economics; Corporate Finance; Mathematics; Statistics,en,2024-03-09,,2024-05-01,,,,3.0,"This book was pretty much Mandelbrot applying fractal geometry to SDEs which was interesting for me in particular as I took a course in SDEs while I read this. The main idea of the book was that modelling the market as a Brownian Motion is overly simplistic and does not accurately model the long tailed nature of the market, making models built on this assumption vulnerable to the volatile nature of markets. Mandelbrot goes on to provide examples of fractals being manifesting in real-world rock formation, tides, etc. to give some intuition on their applications. He finishes the book by explaining in more detail how fractals are applied specifically in financial markets and how using this model we can make better assumptions.

Finance is no science. Everyone uses their own models, and a lot of the time they’re very speculative and are built on very grossly oversimplified assumptions of how markets behave. Mandelbrot asserts that his model does something others don’t, which is that it restates the initial assumptions of how markets behave. The main differences exists in how standard Brownian motion is independent and normally distributed. Mandelbrot’s model states that actually financial markets demonstrate some long-term dependence as well as varying distributions which have longer tails than Gaussian ones. He introduces the concept of the Hurst exponent, H and alpha, ⍺ where the former describes the long-term dependence and the latter describes the fatness of the tails. This more generalized form allows us more flexibility when modelling markets as say a FOREX market may be different than a commodities market.

Overall I found the book to be interesting but I think it’s just a 12-page paper drawn out to be 276 pages in a more high-level novel. For business people, it should be cool to read but for a math student maybe less cool and perhaps I could have just read some scientific literature to get a more low-level understanding of how this idea looks in practice.",Bookshelf (8)
D7B4CBE5-8DB9-4E62-A525-0F583A2F5D24,oXLFEAAAQBAJ,,9780593731383,Read Write Own,Building the Next Era of the Internet,"Dixon, Chris",230,,Random House Publishing Group,"NEW YORK TIMES BESTSELLER • A potent exploration of the power of blockchains to reshape the future of the internet—and how that affects us all—from influential technology entrepreneur and startup investor Chris Dixon
 
“A must for anyone who wants to better understand the real potential of blockchains and web3.”—Robert Iger, CEO, Disney
 
“A compelling vision of where the internet should go and how to get there.”—Sam Altman, co-founder, OpenAI

The internet of today is a far cry from its early promise of a decentralized, democratic network of innovation, connection, and freedom. In the past decade, it has fallen almost entirely under the control of a very small group of companies like Apple, Google, and Facebook. In Read Write Own, tech visionary Chris Dixon argues that the dream of an open network for fostering creativity and entrepreneurship doesn’t have to die and can, in fact, be saved with blockchain networks. He separates this movement, which aims to provide a solid foundation for everything from social networks to artificial intelligence to virtual worlds, from cryptocurrency speculation—a distinction he calls “the computer vs. the casino.”

With lucid and compelling prose—drawing from a twenty-five-year career in the software industry—Dixon shows how the internet has undergone three distinct eras, bringing us to the critical moment we’re in today. The first was the “read” era, in which early networks democratized information. In the “read-write” era, corporate networks democratized publishing. We are now in the midst of the “read-write-own” era, sometimes called web3, in which blockchain networks are granting power and economic benefits to communities of users, not just corporations.

Read Write Own is a must-read for anyone—internet users, business leaders, creators, entrepreneurs—who wants to understand where we’ve been and where we’re going. It provides a vision for a better internet and a playbook to navigate and build the future.",Blockchain; Business & Economics; Computers; Computers & Information Technology; Industries; Internet,en,2024-05-05,,2024-05-12,,,,,,
E2BB8BCB-F315-4D26-9034-1DDADFC31853,L61oDwAAQBAJ,,9781101947906,Exhalation,Stories,"Chiang, Ted",339,,Knopf Doubleday Publishing Group,"NATIONAL BESTSELLER • ONE OF THE NEW YORK TIMES BEST BOOKS OF THE YEAR • Nine stunningly original, provocative, and poignant stories—two published for the very first time—all from the mind of the incomparable author of Stories of Your Life and Others

Tackling some of humanity’s oldest questions along with new quandaries only he could imagine, these stories will change the way you think, feel, and see the world. They are Ted Chiang at his best: profound, sympathetic, revelatory.

Ted Chiang tackles some of humanity’s oldest questions along with new quandaries only he could imagine.

In “The Merchant and the Alchemist’s Gate,” a portal through time forces a fabric seller in ancient Baghdad to grapple with past mistakes and second chances. In “Exhalation,” an alien scientist makes a shocking discovery with ramifications that are literally universal. In “Anxiety Is the Dizziness of Freedom,” the ability to glimpse into alternate universes necessitates a radically new examination of the concepts of choice and free will.",Collections & Anthologies; Fiction; Literary; Science Fiction; Short Stories (single author),en,2024-05-12,,2024-05-20,,,,,"This is a compilation of short stories, I don’t want to discuss all of them but one that particularly resonated with me was *The Truth of Fact, The Truth of Feeling*.

This story is a dual narrative, where the narrator seems to be writing some sort of blog post in a near-future where a product called Remem is about to be introduced that constantly records your day and is always running, bringing up memories you mention or query for in the corner of your sight, like a Apple Vision Pro. 

The writer begins by writing about the virtues of organic memory and has a clear stance against the technology, arguing that it will remove the romance, nostalgia, and story of our memories. He cites marital feuds on who’s right vs. wrong as a type of issue this technology exacerbates.

Concurrently with this narrative we are taken back to the early 1940s where we are observing the Shangev tribe of the Tiv people in Nigeria. This part of the story follows a young boy named Jijingi who through a preacher named Moseby, discovers the power of writing. 

This story resonated with me because of the various ideas it presents without giving a full opinion on. Memory is an interesting subject, my earliest memory was as a child (probably 4/5 years old) in my townhouse with my family on my birthday and my dad coming in from work with a poster of Dash (character from the Incredibles). This memory is so heartwarming to me, the innocent happiness I recall feeling, the youth and energy of my family, who at the time were relative newcomers to the country. The story argues that a memory like this (which is probably artificially reconstructed at this point) is better left as an organic memory. If I had a live feed of it would I still feel the same warmth that I do now? Perhaps conversely, seeing it in finer detail would provide me with more to grasp onto and give me more to look back with love and nostalgia? 

I think this is an interesting thing to consider because I think we partially already deal with this issue to a degree presently with the prevalence of smartphone cameras and the nature in which people document such events so commonly today. 

We then get presented with a strong counter argument which is that our memories are very unreliable. We commonly look back on situations with a nostalgic lens which we can safely argue is not very harmful; we also tend to look back on some disputes with less intensity than we felt in the moment. This is what the narrator argues allows us to move past arguments after the fact, and they cite that perhaps if they had a running highlight reel of their arguments with their daughter, perhaps they would find it more difficult to move past these disputes. 

They then decide to try Remem and look through their arguments with their daughter to give a fair two-sided account of their argument. Essentially, their organic memory failed them and gave them a much rosier account with their relationship with their daughter. Pretty much they recall themselves more as a martyr and really what happened was that they emotionally abused their daughter. This causes the narrator to really reevaluate what they think of themself as a father but also on the utility of Remem as a technology. If it weren’t for Remem they would have continued their life in ignorance without fully understanding how they negatively affected their daughter. This technology enabled them to see things more clearly and take more accountability for their actions. 

Overall, this story shows how we as a humans tend to romanticize our lives. We tend to experience increased juvenoia as we age and discount the utility that certain technologies have despite how they upend certain foundational experiences. This story pretty much says that these technologies are a lot more grey than black or white in their impact. Social media is great because it connects us with family, introduces us to new friends, and helps us find community. It also is very dangerous to youth and can cause psychological problems. It is both good and bad, but if one mindfully uses it with the intent of extracting as much good and staying away from the bad it can be a very beneficial technology, just like how Remem itself could be too. I personally know many strong headed people that will remember certain events through their own rose-tinted glasses that could benefit immensely from such a technology, heck even I could use it as I am particularly stubborn on certain events/arguments.",Bookshelf (22); Science Fiction (2)
2F65F8AD-65D0-489A-8195-942EA9EB9601,RzrKSQAACAAJ,,9781449389550,Hackers & Painters,Big Ideas from the Computer Age,"Graham, Paul",221,,O'Reilly,"""The computer world is like an intellectual Wild West, in which you can shoot anyone you wish with your ideas, if you're willing to risk the consequences. "" --from Hackers & Painters: Big Ideas from the Computer Age, by Paul Graham

We are living in the computer age, in a world increasingly designed and engineered by computer programmers and software designers, by people who call themselves hackers. Who are these people, what motivates them, and why should you care?

Consider these facts: Everything around us is turning into computers. Your typewriter is gone, replaced by a computer. Your phone has turned into a computer. So has your camera. Soon your TV will. Your car was not only designed on computers, but has more processing power in it than a room-sized mainframe did in 1970. Letters, encyclopedias, newspapers, and even your local store are being replaced by the Internet.

Hackers & Painters: Big Ideas from the Computer Age, by Paul Graham, explains this world and the motivations of the people who occupy it. In clear, thoughtful prose that draws on illuminating historical examples, Graham takes readers on an unflinching exploration into what he calls ""an intellectual Wild West.""

The ideas discussed in this book will have a powerful and lasting impact on how we think, how we work, how we develop technology, and how we live. Topics include the importance of beauty in software design, how to make wealth, heresy and free speech, the programming language renaissance, the open-source movement, digital design, internet startups, and more.",Algorithms; Computer Science; Computers; Data Science; Information Technology; Information Theory; Internet; Linux; Networking; Operating Systems; Programming; Security; Social Aspects,en,2024-05-20,,2024-05-30,,,,3.5,"This book is a compilation of essays by the man himself. The first half of the book was not really my cup of tea as it covered subjects like nerds and high school as well as the very outdated claims on web apps being the next big thing (spoiler alert they were). So I powered through this part of the book to arrive at the more relevant and thought provoking second half. Here I sat through PG preach about Lisp, a high-level programming language. While at first I was quite skeptical of his claims, by the end of the book I was wholeheartedly convinced I needed to at least give it a go and try it for myself. Other ideas I appreciated was the parallel drawn between hackers and painters (as demonstrated in the title) and the clear distinction between hackers and computer scientists (something I only subconsciously noticed before). 

Also really loved his repugnance for Java, that language can rot in hell.",Bookshelf (24)
